7,Biología,Genética, ecología y fisiología humana,1º Bachillerato,10/2/2024 0:00:00
8,Filosofía,Lógica, ética y grandes corrientes filosóficas,General,15/2/2024 0:00:00
3,Física,Mecánica, termodinámica y electromagnetismo,2º Bachillerato,20/1/2024 0:00:00
5,Historia de España,Evolución histórica desde la Edad Media,2º Bachillerato,1/2/2024 0:00:00
6,Inglés,Comprensión oral, escrita y conversación,General,1/2/2024 0:00:00
2,Lengua Castellana,Gramática, comprensión lectora y redacción,1º Bachillerato,15/1/2024 0:00:00
1,Matemáticas,Álgebra, cálculo y estadística aplicada,1º Bachillerato,15/1/2024 0:00:00
4,Química,Estructura atómica, reacciones y estequiometría,2º Bachillerato,20/1/2024 0:00:00
